Id,Name,Character,Bio,Icon,Vice
1,Anna Rodriguez,Barista who was always nice to him,Anna receives the letter in the middle of a shift at Barriques. She can't wait ,AnnaRodriguez.svg,Coffee
2,Hal White,His favorite singer in a local band,[FILL ME],AnnaRodriguez.svg,LocalMusic
3,George Beaufort,Butler,[FILL ME],AnnaRodriguez.svg,Cocktails
4,Diamond Jones,Estranged god-daughter,[FILL ME],AnnaRodriguez.svg,BeautyProducts
5,Danny Chang,Guy he talked to in a bar one time,[FILL ME],AnnaRodriguez.svg,Beer